[
  {
    "ceremony_id": "CEREMONY_001",
    "edition_number": 1,
    "ceremony_date": "1959-02-15",
    "broadcast_year": 1959,
    "eligibility_period_start": "1958-10-01",
    "eligibility_period_end": "1959-09-30",
    "host_city": "Los Angeles",
    "venue_id": "VEN_BEVERLY_HILTON",
    "primary_network": "NBC",
    "total_awards_presented": 28,
    "created_at": "1959-02-16T10:00:00Z"
  },
  {
    "ceremony_id": "CEREMONY_002",
    "edition_number": 2,
    "ceremony_date": "1960-02-15",
    "broadcast_year": 1960,
    "eligibility_period_start": "1959-10-01",
    "eligibility_period_end": "1960-09-30",
    "host_city": "Los Angeles",
    "venue_id": "VEN_SHRINE_AUDITORIUM",
    "primary_network": "NBC",
    "total_awards_presented": 42,
    "created_at": "1960-02-16T10:00:00Z"
  },
  {
    "ceremony_id": "CEREMONY_003",
    "edition_number": 3,
    "ceremony_date": "1961-02-15",
    "broadcast_year": 1961,
    "eligibility_period_start": "1960-10-01",
    "eligibility_period_end": "1961-09-30",
    "host_city": "Los Angeles",
    "venue_id": "VEN_CRYPTO_LA",
    "primary_network": "NBC",
    "total_awards_presented": 43,
    "created_at": "1961-02-16T10:00:00Z"
  },
  {
    "ceremony_id": "CEREMONY_004",
    "edition_number": 4,
    "ceremony_date": "1962-02-15",
    "broadcast_year": 1962,
    "eligibility_period_start": "1961-10-01",
    "eligibility_period_end": "1962-09-30",
    "host_city": "New York",
    "venue_id": "VEN_MSG_NY",
    "primary_network": "NBC",
    "total_awards_presented": 44,
    "created_at": "1962-02-16T10:00:00Z"
  },
  {
    "ceremony_id": "CEREMONY_005",
    "edition_number": 5,
    "ceremony_date": "1963-02-15",
    "broadcast_year": 1963,
    "eligibility_period_start": "1962-10-01",
    "eligibility_period_end": "1963-09-30",
    "host_city": "New York",
    "venue_id": "VEN_RADIO_CITY_NY",
    "primary_network": "NBC",
    "total_awards_presented": 45,
    "created_at": "1963-02-16T10:00:00Z"
  },
  {
    "ceremony_id": "CEREMONY_006",
    "edition_number": 6,
    "ceremony_date": "1964-02-15",
    "broadcast_year": 1964,
    "eligibility_period_start": "1963-10-01",
    "eligibility_period_end": "1964-09-30",
    "host_city": "Las Vegas",
    "venue_id": "VEN_MGM_GRAND_LV",
    "primary_network": "NBC",
    "total_awards_presented": 46,
    "created_at": "1964-02-16T10:00:00Z"
  },
  {
    "ceremony_id": "CEREMONY_007",
    "edition_number": 7,
    "ceremony_date": "1965-02-15",
    "broadcast_year": 1965,
    "eligibility_period_start": "1964-10-01",
    "eligibility_period_end": "1965-09-30",
    "host_city": "Los Angeles",
    "venue_id": "VEN_BEVERLY_HILTON",
    "primary_network": "NBC",
    "total_awards_presented": 47,
    "created_at": "1965-02-16T10:00:00Z"
  },
  {
    "ceremony_id": "CEREMONY_008",
    "edition_number": 8,
    "ceremony_date": "1966-02-15",
    "broadcast_year": 1966,
    "eligibility_period_start": "1965-10-01",
    "eligibility_period_end": "1966-09-30",
    "host_city": "Los Angeles",
    "venue_id": "VEN_SHRINE_AUDITORIUM",
    "primary_network": "NBC",
    "total_awards_presented": 48,
    "created_at": "1966-02-16T10:00:00Z"
  },
  {
    "ceremony_id": "CEREMONY_009",
    "edition_number": 9,
    "ceremony_date": "1967-02-15",
    "broadcast_year": 1967,
    "eligibility_period_start": "1966-10-01",
    "eligibility_period_end": "1967-09-30",
    "host_city": "Los Angeles",
    "venue_id": "VEN_CRYPTO_LA",
    "primary_network": "NBC",
    "total_awards_presented": 49,
    "created_at": "1967-02-16T10:00:00Z"
  },
  {
    "ceremony_id": "CEREMONY_010",
    "edition_number": 10,
    "ceremony_date": "1968-02-15",
    "broadcast_year": 1968,
    "eligibility_period_start": "1967-10-01",
    "eligibility_period_end": "1968-09-30",
    "host_city": "New York",
    "venue_id": "VEN_MSG_NY",
    "primary_network": "NBC",
    "total_awards_presented": 50,
    "created_at": "1968-02-16T10:00:00Z"
  },
  {
    "ceremony_id": "CEREMONY_011",
    "edition_number": 11,
    "ceremony_date": "1969-02-15",
    "broadcast_year": 1969,
    "eligibility_period_start": "1968-10-01",
    "eligibility_period_end": "1969-09-30",
    "host_city": "New York",
    "venue_id": "VEN_RADIO_CITY_NY",
    "primary_network": "NBC",
    "total_awards_presented": 51,
    "created_at": "1969-02-16T10:00:00Z"
  },
  {
    "ceremony_id": "CEREMONY_012",
    "edition_number": 12,
    "ceremony_date": "1970-02-15",
    "broadcast_year": 1970,
    "eligibility_period_start": "1969-10-01",
    "eligibility_period_end": "1970-09-30",
    "host_city": "Las Vegas",
    "venue_id": "VEN_MGM_GRAND_LV",
    "primary_network": "NBC",
    "total_awards_presented": 52,
    "created_at": "1970-02-16T10:00:00Z"
  },
  {
    "ceremony_id": "CEREMONY_013",
    "edition_number": 13,
    "ceremony_date": "1971-02-15",
    "broadcast_year": 1971,
    "eligibility_period_start": "1970-10-01",
    "eligibility_period_end": "1971-09-30",
    "host_city": "Los Angeles",
    "venue_id": "VEN_BEVERLY_HILTON",
    "primary_network": "NBC",
    "total_awards_presented": 53,
    "created_at": "1971-02-16T10:00:00Z"
  },
  {
    "ceremony_id": "CEREMONY_014",
    "edition_number": 14,
    "ceremony_date": "1972-02-15",
    "broadcast_year": 1972,
    "eligibility_period_start": "1971-10-01",
    "eligibility_period_end": "1972-09-30",
    "host_city": "Los Angeles",
    "venue_id": "VEN_SHRINE_AUDITORIUM",
    "primary_network": "CBS",
    "total_awards_presented": 54,
    "created_at": "1972-02-16T10:00:00Z"
  },
  {
    "ceremony_id": "CEREMONY_015",
    "edition_number": 15,
    "ceremony_date": "1973-02-15",
    "broadcast_year": 1973,
    "eligibility_period_start": "1972-10-01",
    "eligibility_period_end": "1973-09-30",
    "host_city": "Los Angeles",
    "venue_id": "VEN_CRYPTO_LA",
    "primary_network": "CBS",
    "total_awards_presented": 55,
    "created_at": "1973-02-16T10:00:00Z"
  },
  {
    "ceremony_id": "CEREMONY_016",
    "edition_number": 16,
    "ceremony_date": "1974-02-15",
    "broadcast_year": 1974,
    "eligibility_period_start": "1973-10-01",
    "eligibility_period_end": "1974-09-30",
    "host_city": "New York",
    "venue_id": "VEN_MSG_NY",
    "primary_network": "CBS",
    "total_awards_presented": 56,
    "created_at": "1974-02-16T10:00:00Z"
  },
  {
    "ceremony_id": "CEREMONY_017",
    "edition_number": 17,
    "ceremony_date": "1975-02-15",
    "broadcast_year": 1975,
    "eligibility_period_start": "1974-10-01",
    "eligibility_period_end": "1975-09-30",
    "host_city": "New York",
    "venue_id": "VEN_RADIO_CITY_NY",
    "primary_network": "CBS",
    "total_awards_presented": 57,
    "created_at": "1975-02-16T10:00:00Z"
  },
  {
    "ceremony_id": "CEREMONY_018",
    "edition_number": 18,
    "ceremony_date": "1976-02-15",
    "broadcast_year": 1976,
    "eligibility_period_start": "1975-10-01",
    "eligibility_period_end": "1976-09-30",
    "host_city": "Las Vegas",
    "venue_id": "VEN_MGM_GRAND_LV",
    "primary_network": "CBS",
    "total_awards_presented": 58,
    "created_at": "1976-02-16T10:00:00Z"
  },
  {
    "ceremony_id": "CEREMONY_019",
    "edition_number": 19,
    "ceremony_date": "1977-02-15",
    "broadcast_year": 1977,
    "eligibility_period_start": "1976-10-01",
    "eligibility_period_end": "1977-09-30",
    "host_city": "Los Angeles",
    "venue_id": "VEN_BEVERLY_HILTON",
    "primary_network": "CBS",
    "total_awards_presented": 59,
    "created_at": "1977-02-16T10:00:00Z"
  },
  {
    "ceremony_id": "CEREMONY_020",
    "edition_number": 20,
    "ceremony_date": "1978-02-15",
    "broadcast_year": 1978,
    "eligibility_period_start": "1977-10-01",
    "eligibility_period_end": "1978-09-30",
    "host_city": "Los Angeles",
    "venue_id": "VEN_SHRINE_AUDITORIUM",
    "primary_network": "CBS",
    "total_awards_presented": 60,
    "created_at": "1978-02-16T10:00:00Z"
  },
  {
    "ceremony_id": "CEREMONY_021",
    "edition_number": 21,
    "ceremony_date": "1979-02-15",
    "broadcast_year": 1979,
    "eligibility_period_start": "1978-10-01",
    "eligibility_period_end": "1979-09-30",
    "host_city": "Los Angeles",
    "venue_id": "VEN_CRYPTO_LA",
    "primary_network": "CBS",
    "total_awards_presented": 61,
    "created_at": "1979-02-16T10:00:00Z"
  },
  {
    "ceremony_id": "CEREMONY_022",
    "edition_number": 22,
    "ceremony_date": "1980-02-15",
    "broadcast_year": 1980,
    "eligibility_period_start": "1979-10-01",
    "eligibility_period_end": "1980-09-30",
    "host_city": "New York",
    "venue_id": "VEN_MSG_NY",
    "primary_network": "CBS",
    "total_awards_presented": 62,
    "created_at": "1980-02-16T10:00:00Z"
  },
  {
    "ceremony_id": "CEREMONY_023",
    "edition_number": 23,
    "ceremony_date": "1981-02-15",
    "broadcast_year": 1981,
    "eligibility_period_start": "1980-10-01",
    "eligibility_period_end": "1981-09-30",
    "host_city": "New York",
    "venue_id": "VEN_RADIO_CITY_NY",
    "primary_network": "CBS",
    "total_awards_presented": 63,
    "created_at": "1981-02-16T10:00:00Z"
  },
  {
    "ceremony_id": "CEREMONY_024",
    "edition_number": 24,
    "ceremony_date": "1982-02-15",
    "broadcast_year": 1982,
    "eligibility_period_start": "1981-10-01",
    "eligibility_period_end": "1982-09-30",
    "host_city": "Las Vegas",
    "venue_id": "VEN_MGM_GRAND_LV",
    "primary_network": "CBS",
    "total_awards_presented": 64,
    "created_at": "1982-02-16T10:00:00Z"
  },
  {
    "ceremony_id": "CEREMONY_025",
    "edition_number": 25,
    "ceremony_date": "1983-02-15",
    "broadcast_year": 1983,
    "eligibility_period_start": "1982-10-01",
    "eligibility_period_end": "1983-09-30",
    "host_city": "Los Angeles",
    "venue_id": "VEN_BEVERLY_HILTON",
    "primary_network": "CBS",
    "total_awards_presented": 65,
    "created_at": "1983-02-16T10:00:00Z"
  },
  {
    "ceremony_id": "CEREMONY_026",
    "edition_number": 26,
    "ceremony_date": "1984-02-15",
    "broadcast_year": 1984,